<?xml version="1.0"?>
<!DOCTYPE Report
[
<!ELEMENT Report (General ,(Doc|BPT)) >
<!ATTLIST Report ver CDATA #REQUIRED tmZone CDATA #REQUIRED>

<!ELEMENT General ( DocLocation ) >
<!ATTLIST General productName CDATA #REQUIRED productVer CDATA #REQUIRED os CDATA #REQUIRED host CDATA #REQUIRED qcserver CDATA #IMPLIED qcproject CDATA #IMPLIED SolManSolutionId CDATA #IMPLIED SolManProjectId CDATA #IMPLIED SolManTestPlanId CDATA #IMPLIED SolManTestPackageId CDATA #IMPLIED SolManUserInfoData CDATA #IMPLIED  >

<!ELEMENT BPT (DName,Res,DVer?,TSet?,TInst?,NodeArgs,AdditionalInfo*,Doc*) >
<!ATTLIST BPT rID ID #REQUIRED >

<!ELEMENT Doc (DName,ConfName?,Res,DVer?,TSet?,TInst?,RunType?,DT?,AdditionalInfo*,Step*,DIter*,Step*,Action*,Doc*,Summary?,TestMaintenanceSummary*,NodeArgs?) >
<!ATTLIST Doc rID ID #REQUIRED type (Test|BC|BPTWrapperTest|Flow|Group|Action) "Test" productName CDATA #REQUIRED BCIter CDATA #IMPLIED >

<!ELEMENT RunType ( #PCDATA )>
<!ATTLIST RunType fmStep (False|True) "False" batch (False|True) "False" upDesc (False|True) "False" upChk (False|True) "False" upAS (False|True) "False">

<!ELEMENT DName ( #PCDATA ) >

<!ELEMENT ConfName ( #PCDATA ) >

<!ELEMENT Res ( #PCDATA ) >

<!ELEMENT AdditionalInfo (AdditionalDataName,AdditionalDataValue ) >

<!ELEMENT AdditionalDataName ( #PCDATA ) >

<!ELEMENT AdditionalDataValue ( #PCDATA ) >

<!ELEMENT DVer ( #PCDATA ) >

<!ELEMENT TSet ( #PCDATA ) >

<!ELEMENT TInst ( #PCDATA ) >

<!ELEMENT DIter (Step*,Action+,Summary?,NodeArgs)>
<!ATTLIST DIter rID ID #REQUIRED iterID CDATA #REQUIRED>

<!ELEMENT DocLocation ( #PCDATA )>

<!ELEMENT Action (AName,AIter*,(Step|HtmlStep|Action)*, Summary,ActionMaintenanceSummary*, NodeArgs ) >
<!ATTLIST Action rID ID #REQUIRED>

<!ELEMENT AIter ((Step|HtmlStep|Action)*,DataMapping?, Summary?,NodeArgs) >
<!ATTLIST AIter rID ID #REQUIRED iterID CDATA #REQUIRED isCountable (False|True) "False" >

<!ELEMENT AName ( #PCDATA ) >

<!ELEMENT TestMaintenanceSummary (ActionMaintenanceSummary*) >
<!ATTLIST TestMaintenanceSummary ObjectsAdded CDATA #REQUIRED ObjectsUpdated CDATA #REQUIRED StepsUpdated CDATA #REQUIRED StepsComments CDATA #REQUIRED><!ELEMENT ActionMaintenanceSummary (ObjectChange* ) >
<!ATTLIST ActionMaintenanceSummary Action CDATA #REQUIRED Objects CDATA #REQUIRED Updated CDATA #REQUIRED LinesTotal CDATA #REQUIRED Added CDATA #REQUIRED LinesUpdated CDATA #REQUIRED>

<!ELEMENT ObjectChange  (Hierarchy, PropertyChangeList* ) >
<!ATTLIST ObjectChange Operation CDATA #IMPLIED OriginalRepository CDATA #IMPLIED>

<!ELEMENT PropertyChangeList (PropertyDef*) >

<!ELEMENT PropertyDef (OriginalValue, NewValue) >
<!ATTLIST PropertyDef PropName CDATA #REQUIRED OriginRegularExpression (True|False) "False" NewRegularExpression (True|False) "False" AddedProperty (True|False) "False" >

<!ELEMENT OriginalValue ( #PCDATA )>

<!ELEMENT NewValue ( #PCDATA )>

<!ELEMENT Hierarchy  (ObjectName, Hierarchy*) >
<!ATTLIST Hierarchy MicClass CDATA #REQUIRED>

<!ELEMENT ObjectName  ( #PCDATA ) >

<!ELEMENT Step (Obj,Details,Time,TimeTick* ,(Step|HtmlStep|Doc)*, DataMapping?, NodeArgs) >
<!ATTLIST Step rID ID #REQUIRED retval CDATA #IMPLIED>

<!ELEMENT HtmlStep (HTML,TimeTick*,(Step|HtmlStep|Doc)*,NodeArgs) >
<!ATTLIST HtmlStep rID ID #REQUIRED >

<!ELEMENT Obj ( #PCDATA ) >
<!ATTLIST Obj plainTxt (False|True) "True">

<!ELEMENT Details ( #PCDATA ) >
<!ATTLIST Details plainTxt (False|True) "True">

<!ELEMENT Time ( #PCDATA ) >

<!ELEMENT HTML ( #PCDATA ) >

<!ELEMENT Disp ( #PCDATA ) >

<!ELEMENT TimeTick ( #PCDATA ) >

<!ELEMENT DataMapping ( DataMappedItem* )>
<!ELEMENT DataMappedItem EMPTY >
<!ATTLIST DataMappedItem dsName CDATA #REQUIRED >
<!ATTLIST DataMappedItem rowId CDATA #REQUIRED >

<!ELEMENT NodeArgs (Disp,TopPane?,BtmPane?,ExtendedInfo? )>
<!ATTLIST NodeArgs eType CDATA #REQUIRED icon CDATA #REQUIRED nRep CDATA #REQUIRED UserNote CDATA #IMPLIED filter (False|True) "True">
<!ATTLIST NodeArgs status (Passed|Failed|Done|Warning|Information) "Done">
<!ATTLIST NodeArgs iconSel CDATA #IMPLIED nType CDATA #IMPLIED MovieMarker CDATA "">
<!ATTLIST NodeArgs Source CDATA #IMPLIED SourceLine CDATA #IMPLIED StepFlowItemKey CDATA #IMPLIED >

<!ELEMENT TopPane (Path)>

<!ELEMENT BtmPane ( (Path|WR)?,ASHilite?)>
<!ATTLIST BtmPane vType CDATA "HTML">

<!ELEMENT Path ( #PCDATA ) >

<!ELEMENT ASHilite ( #PCDATA ) >

<!ELEMENT WR ( #PCDATA ) >

<!ELEMENT ExtendedInfo ( StepData ) >

<!ATTLIST ExtendedInfo StepType CDATA #REQUIRED>
<!ELEMENT DT (NodeArgs) >
<!ATTLIST DT rID ID #REQUIRED>

<!ELEMENT Summary (Param*)>
<!ATTLIST Summary sTime CDATA #IMPLIED eTime CDATA #IMPLIED passed CDATA #IMPLIED failed CDATA #IMPLIED warnings CDATA #IMPLIED retval CDATA #IMPLIED stopped (False|True) "False" >

<!ELEMENT Param (ParamName,ParamVal)+ >
<!ATTLIST Param paramInOut (In|Out) "In">

<!ELEMENT ParamName ( #PCDATA ) >

<!ELEMENT ParamVal ( #PCDATA ) >

]
>
<Report ver="2.0" tmZone="SE Asia Standard Time">
<General productName="HP Unified Functional Testing" productVer="12.01" os="Windows 8" host="NOTEBOOK"><DocLocation><![CDATA[C:\ESD_Test\Bin\ESD_Test]]></DocLocation></General>
<Doc rID="T1"   productName= "HP Unified Functional Testing"  >
<DName><![CDATA[ESD_Test]]></DName>
<Res><![CDATA[Res70]]></Res>
<DT rID="T2">
<NodeArgs eType="Table" icon="2" nRep="4" filter="False" >
<Disp><![CDATA[Run-Time Data Table]]></Disp>
<BtmPane vType="Table" >
<Path><![CDATA[Default.xls]]></Path>
</BtmPane>
</NodeArgs>
</DT>
<DIter rID="T3" iterID="1" >
<Action rID="T4">
<AName><![CDATA[ESD]]></AName>
<Step rID="T5">
<Obj plainTxt="False" ><![CDATA[eSkyDesk Management]]></Obj>
<Details plainTxt="False" ><![CDATA[Browser]]></Details>
<Time><![CDATA[9/6/2014 - 9:21:47]]></Time>
<TimeTick>1409970107</TimeTick>
<Step rID="T6">
<Obj plainTxt="False" ><![CDATA[eSkyDesk Management]]></Obj>
<Details plainTxt="False" ><![CDATA[Page]]></Details>
<Time><![CDATA[9/6/2014 - 9:21:47]]></Time>
<TimeTick>1409970107</TimeTick>
<Step rID="T7">
<Obj plainTxt="False" ><![CDATA[Login.Exist]]></Obj>
<Details plainTxt="False" ><![CDATA["Object exists"]]></Details>
<Time><![CDATA[9/6/2014 - 9:21:47]]></Time>
<TimeTick>1409970107</TimeTick>
<NodeArgs eType="Replay" icon="7" nRep="11" >
<Disp><![CDATA[Login.Exist]]></Disp>
</NodeArgs>
</Step>
<Step rID="T8">
<Obj plainTxt="False" ><![CDATA[Login.Click]]></Obj>
<Details plainTxt="False" ><![CDATA[]]></Details>
<Time><![CDATA[9/6/2014 - 9:21:47]]></Time>
<TimeTick>1409970107</TimeTick>
<NodeArgs eType="Replay" icon="7" nRep="14" >
<Disp><![CDATA[Login.Click]]></Disp>
</NodeArgs>
</Step>
<Step rID="T9">
<Obj plainTxt="False" ><![CDATA[[ Window ].Exist]]></Obj>
<Details plainTxt="False" ><![CDATA["Object does not exist"]]></Details>
<Time><![CDATA[9/6/2014 - 9:21:48]]></Time>
<TimeTick>1409970108</TimeTick>
<NodeArgs eType="Replay" icon="8" nRep="16" >
<Disp><![CDATA[[ Window ].Exist]]></Disp>
</NodeArgs>
</Step>
<Step rID="T10">
<Obj plainTxt="False" ><![CDATA[Add Batch Profile]]></Obj>
<Details plainTxt="False" ><![CDATA[WebElement]]></Details>
<Time><![CDATA[9/6/2014 - 9:21:52]]></Time>
<TimeTick>1409970112</TimeTick>
<HtmlStep rID="T11">
<HTML><![CDATA[<html>
<head>
<META HTTP-EQUIV="Content-Type" CONTENT="text/html; charset=UTF-8"/>
<base href=""/>
<link rel="stylesheet" href="Results.css"/>
</head>
<body bgcolor="#ffffff" leftmargin="20" marginwidth="20" topmargin="10" marginheight="10" vlink="#9966cc">
<table border="0" cellpadding="0" cellspacing="0" width="100%">
	<tr><td height="1" class="bg_midblue"></td></tr>
	<tr><td height="30"><span class="hl1"> Bitmap Checkpoint "Add Batch Profile": </span><span class="PassedHigh">Passed</span></td></tr>
	<tr><td height="2" class="bg_darkblue"></td></tr>
	<tr><td height="10"></td></tr>
	<tr><td><span class="text"><b>Date and Time:</b> 9/6/2014 - 9:21:52</span></td></tr>
		
	<tr><td height="15"></td></tr>
</table>
<!--Until here code from report media-->
<table border="0" cellpadding="0" cellspacing="0" width="100%" id=TABLE2><tr height="1"><td height="1" class="bg_gray_ccc"></td></tr><tr><td height="5"></td></tr></table></body></html>]]></HTML>
<TimeTick>1409970112</TimeTick>
<NodeArgs eType="Verification" icon="9" nRep="19" status="Passed" >
<Disp><![CDATA[Checkpoint "Add Batch Profile"]]></Disp>
</NodeArgs>
</HtmlStep>
<NodeArgs eType="Context" icon="9" nRep="18" status="Passed" >
<Disp><![CDATA[Add Batch Profile]]></Disp>
</NodeArgs>
</Step>
<Step rID="T12">
<Obj plainTxt="False" ><![CDATA[Add Batch Profile.Click]]></Obj>
<Details plainTxt="False" ><![CDATA[]]></Details>
<Time><![CDATA[9/6/2014 - 9:21:52]]></Time>
<TimeTick>1409970112</TimeTick>
<NodeArgs eType="Replay" icon="9" nRep="22" >
<Disp><![CDATA[Add Batch Profile.Click]]></Disp>
</NodeArgs>
</Step>
<Step rID="T13">
<Obj plainTxt="False" ><![CDATA[Save.Click]]></Obj>
<Details plainTxt="False" ><![CDATA[]]></Details>
<Time><![CDATA[9/6/2014 - 9:21:53]]></Time>
<TimeTick>1409970113</TimeTick>
<NodeArgs eType="Replay" icon="7" nRep="26" >
<Disp><![CDATA[Save.Click]]></Disp>
</NodeArgs>
</Step>
<Step rID="T14">
<Obj plainTxt="False" ><![CDATA[OK.Exist]]></Obj>
<Details plainTxt="False" ><![CDATA["Object exists"]]></Details>
<Time><![CDATA[9/6/2014 - 9:21:53]]></Time>
<TimeTick>1409970113</TimeTick>
<NodeArgs eType="Replay" icon="7" nRep="28" >
<Disp><![CDATA[OK.Exist]]></Disp>
</NodeArgs>
</Step>
<NodeArgs eType="Context" icon="6" nRep="10" status="Passed" >
<Disp><![CDATA[eSkyDesk Management]]></Disp>
</NodeArgs>
</Step>
<NodeArgs eType="Context" icon="5" nRep="9" status="Passed" >
<Disp><![CDATA[eSkyDesk Management]]></Disp>
</NodeArgs>
</Step>
<Step rID="T15">
<Obj ><![CDATA[Get 'Button' with name 'OK' at Browser 'eSkyDesk Management' successfully ]]></Obj>
<Details ><![CDATA[Passed]]></Details>
<Time><![CDATA[9/6/2014 - 9:21:56]]></Time>
<TimeTick>1409970116</TimeTick>
<NodeArgs eType="User" icon="10" nRep="29" status="Passed" >
<Disp><![CDATA[Get 'Button' with name 'OK' at Browser 'eSkyDesk Management' successfully ]]></Disp>
</NodeArgs>
</Step>
<Step rID="T16">
<Obj plainTxt="False" ><![CDATA[eSkyDesk Management]]></Obj>
<Details plainTxt="False" ><![CDATA[Browser]]></Details>
<Time><![CDATA[9/6/2014 - 9:21:56]]></Time>
<TimeTick>1409970116</TimeTick>
<Step rID="T17">
<Obj plainTxt="False" ><![CDATA[eSkyDesk Management]]></Obj>
<Details plainTxt="False" ><![CDATA[Page]]></Details>
<Time><![CDATA[9/6/2014 - 9:21:56]]></Time>
<TimeTick>1409970116</TimeTick>
<Step rID="T18">
<Obj plainTxt="False" ><![CDATA[OK.Exist]]></Obj>
<Details plainTxt="False" ><![CDATA["Object exists"]]></Details>
<Time><![CDATA[9/6/2014 - 9:21:56]]></Time>
<TimeTick>1409970116</TimeTick>
<NodeArgs eType="Replay" icon="7" nRep="33" >
<Disp><![CDATA[OK.Exist]]></Disp>
</NodeArgs>
</Step>
<Step rID="T19">
<Obj plainTxt="False" ><![CDATA[OK.Click]]></Obj>
<Details plainTxt="False" ><![CDATA[]]></Details>
<Time><![CDATA[9/6/2014 - 9:21:56]]></Time>
<TimeTick>1409970116</TimeTick>
<NodeArgs eType="Replay" icon="7" nRep="35" >
<Disp><![CDATA[OK.Click]]></Disp>
</NodeArgs>
</Step>
<NodeArgs eType="Context" icon="6" nRep="32" >
<Disp><![CDATA[eSkyDesk Management]]></Disp>
</NodeArgs>
</Step>
<NodeArgs eType="Context" icon="5" nRep="31" >
<Disp><![CDATA[eSkyDesk Management]]></Disp>
</NodeArgs>
</Step>
<Step rID="T20">
<Obj ><![CDATA[Press button 'OK' at Browser 'eSkyDesk Management' successfully]]></Obj>
<Details ><![CDATA[Passed]]></Details>
<Time><![CDATA[9/6/2014 - 9:21:56]]></Time>
<TimeTick>1409970116</TimeTick>
<NodeArgs eType="User" icon="10" nRep="36" status="Passed" >
<Disp><![CDATA[Press button 'OK' at Browser 'eSkyDesk Management' successfully]]></Disp>
</NodeArgs>
</Step>
<Step rID="T21">
<Obj plainTxt="False" ><![CDATA[eSkyDesk Management]]></Obj>
<Details plainTxt="False" ><![CDATA[Browser]]></Details>
<Time><![CDATA[9/6/2014 - 9:21:56]]></Time>
<TimeTick>1409970116</TimeTick>
<Step rID="T22">
<Obj plainTxt="False" ><![CDATA[eSkyDesk Management]]></Obj>
<Details plainTxt="False" ><![CDATA[Page]]></Details>
<Time><![CDATA[9/6/2014 - 9:21:56]]></Time>
<TimeTick>1409970116</TimeTick>
<Step rID="T23">
<Obj plainTxt="False" ><![CDATA[WebEdit.Set]]></Obj>
<Details plainTxt="False" ><![CDATA["AT_Create_BP_Successfull"]]></Details>
<Time><![CDATA[9/6/2014 - 9:21:56]]></Time>
<TimeTick>1409970116</TimeTick>
<NodeArgs eType="Replay" icon="11" nRep="41" >
<Disp><![CDATA[WebEdit.Set]]></Disp>
</NodeArgs>
</Step>
<Step rID="T24">
<Obj plainTxt="False" ><![CDATA["WebEdit_2"- Smart Identification]]></Obj>
<Details plainTxt="False" ><![CDATA[<P><span class="text">The smart identification mechanism was invoked.</span></P><P><SPAN class=text>Reason: object not unique (2 objects found)</SPAN></P>           <SPAN class=text><b>Original description:</b></SPAN><br>type=text<br>name=WebEdit<br>micclass=WebEdit<br>html tag=INPUT<br><P><FONT face=Verdana size=2><SPAN class=text><B>Smart Identification Alternative Description: </B></SPAN></FONT></P><FONT face=Verdana size=2><u>Base filter properties (2 objects found)&nbsp;</FONT></u><br>
type=text<br>micclass=WebEdit<br>html tag=INPUT<br><br><FONT face=Verdana size=2><u>Optional filter properties</FONT></u><br>
name=WebEdit<SPAN class=passed> (Used</SPAN>, 2 matches)</SPAN><br>html id=field_name<SPAN class=Failed> (Skipped)</SPAN><br>max length=-1<SPAN class=passed> (Used</SPAN>, 2 matches)</SPAN><br>default value=<SPAN class=passed> (Used</SPAN>, 2 matches)</SPAN><br>class=form-control input-sm<SPAN class=passed> (Used</SPAN>, 1 matches)</SPAN><br>rows=0<SPAN class=warning> (Ignored)<FONT color=#000000></FONT></SPAN><br>visible=1<SPAN class=warning> (Ignored)<FONT color=#000000></FONT></SPAN><br>]]></Details>
<Time><![CDATA[9/6/2014 - 9:21:56]]></Time>
<TimeTick>1409970116</TimeTick>
<NodeArgs eType="Replay" icon="12" nRep="44" >
<Disp><![CDATA["WebEdit_2"- Smart Identification]]></Disp>
</NodeArgs>
</Step>
<Step rID="T25">
<Obj plainTxt="False" ><![CDATA[WebEdit_2.Set]]></Obj>
<Details plainTxt="False" ><![CDATA["Create BP Successfull"]]></Details>
<Time><![CDATA[9/6/2014 - 9:21:56]]></Time>
<TimeTick>1409970116</TimeTick>
<NodeArgs eType="Replay" icon="11" nRep="45" >
<Disp><![CDATA[WebEdit_2.Set]]></Disp>
</NodeArgs>
</Step>
<Step rID="T26">
<Obj plainTxt="False" ><![CDATA[Save.Click]]></Obj>
<Details plainTxt="False" ><![CDATA[]]></Details>
<Time><![CDATA[9/6/2014 - 9:21:57]]></Time>
<TimeTick>1409970117</TimeTick>
<NodeArgs eType="Replay" icon="7" nRep="48" >
<Disp><![CDATA[Save.Click]]></Disp>
</NodeArgs>
</Step>
<Step rID="T27">
<Obj plainTxt="False" ><![CDATA[OK.Exist]]></Obj>
<Details plainTxt="False" ><![CDATA["Object exists"]]></Details>
<Time><![CDATA[9/6/2014 - 9:21:57]]></Time>
<TimeTick>1409970117</TimeTick>
<NodeArgs eType="Replay" icon="7" nRep="50" >
<Disp><![CDATA[OK.Exist]]></Disp>
</NodeArgs>
</Step>
<NodeArgs eType="Context" icon="6" nRep="40" >
<Disp><![CDATA[eSkyDesk Management]]></Disp>
</NodeArgs>
</Step>
<NodeArgs eType="Context" icon="5" nRep="39" >
<Disp><![CDATA[eSkyDesk Management]]></Disp>
</NodeArgs>
</Step>
<Step rID="T28">
<Obj ><![CDATA[Get 'Button' with name 'OK' at Browser 'eSkyDesk Management' successfully ]]></Obj>
<Details ><![CDATA[Passed]]></Details>
<Time><![CDATA[9/6/2014 - 9:22:00]]></Time>
<TimeTick>1409970120</TimeTick>
<NodeArgs eType="User" icon="10" nRep="51" status="Passed" >
<Disp><![CDATA[Get 'Button' with name 'OK' at Browser 'eSkyDesk Management' successfully ]]></Disp>
</NodeArgs>
</Step>
<Step rID="T29">
<Obj plainTxt="False" ><![CDATA[eSkyDesk Management]]></Obj>
<Details plainTxt="False" ><![CDATA[Browser]]></Details>
<Time><![CDATA[9/6/2014 - 9:22:00]]></Time>
<TimeTick>1409970120</TimeTick>
<Step rID="T30">
<Obj plainTxt="False" ><![CDATA[eSkyDesk Management]]></Obj>
<Details plainTxt="False" ><![CDATA[Page]]></Details>
<Time><![CDATA[9/6/2014 - 9:22:00]]></Time>
<TimeTick>1409970120</TimeTick>
<Step rID="T31">
<Obj plainTxt="False" ><![CDATA[OK.Exist]]></Obj>
<Details plainTxt="False" ><![CDATA["Object exists"]]></Details>
<Time><![CDATA[9/6/2014 - 9:22:00]]></Time>
<TimeTick>1409970120</TimeTick>
<NodeArgs eType="Replay" icon="7" nRep="55" >
<Disp><![CDATA[OK.Exist]]></Disp>
</NodeArgs>
</Step>
<Step rID="T32">
<Obj plainTxt="False" ><![CDATA[OK.Click]]></Obj>
<Details plainTxt="False" ><![CDATA[]]></Details>
<Time><![CDATA[9/6/2014 - 9:22:00]]></Time>
<TimeTick>1409970120</TimeTick>
<NodeArgs eType="Replay" icon="7" nRep="57" >
<Disp><![CDATA[OK.Click]]></Disp>
</NodeArgs>
</Step>
<NodeArgs eType="Context" icon="6" nRep="54" >
<Disp><![CDATA[eSkyDesk Management]]></Disp>
</NodeArgs>
</Step>
<NodeArgs eType="Context" icon="5" nRep="53" >
<Disp><![CDATA[eSkyDesk Management]]></Disp>
</NodeArgs>
</Step>
<Step rID="T33">
<Obj ><![CDATA[Press button 'OK' at Browser 'eSkyDesk Management' successfully]]></Obj>
<Details ><![CDATA[Passed]]></Details>
<Time><![CDATA[9/6/2014 - 9:22:00]]></Time>
<TimeTick>1409970120</TimeTick>
<NodeArgs eType="User" icon="10" nRep="58" status="Passed" >
<Disp><![CDATA[Press button 'OK' at Browser 'eSkyDesk Management' successfully]]></Disp>
</NodeArgs>
</Step>
<Step rID="T34">
<Obj plainTxt="False" ><![CDATA[[ Window ].Exist]]></Obj>
<Details plainTxt="False" ><![CDATA["Object does not exist"]]></Details>
<Time><![CDATA[9/6/2014 - 9:22:01]]></Time>
<TimeTick>1409970121</TimeTick>
<NodeArgs eType="Replay" icon="8" nRep="60" >
<Disp><![CDATA[[ Window ].Exist]]></Disp>
</NodeArgs>
</Step>
<Step rID="T35">
<Obj plainTxt="False" ><![CDATA[eSkyDesk Management]]></Obj>
<Details plainTxt="False" ><![CDATA[Browser]]></Details>
<Time><![CDATA[9/6/2014 - 9:22:01]]></Time>
<TimeTick>1409970121</TimeTick>
<Step rID="T36">
<Obj plainTxt="False" ><![CDATA[eSkyDesk Management]]></Obj>
<Details plainTxt="False" ><![CDATA[Page]]></Details>
<Time><![CDATA[9/6/2014 - 9:22:01]]></Time>
<TimeTick>1409970121</TimeTick>
<Step rID="T37">
<Obj plainTxt="False" ><![CDATA[Add Meta Data.Exist]]></Obj>
<Details plainTxt="False" ><![CDATA["Object exists"]]></Details>
<Time><![CDATA[9/6/2014 - 9:22:01]]></Time>
<TimeTick>1409970121</TimeTick>
<NodeArgs eType="Replay" icon="7" nRep="64" >
<Disp><![CDATA[Add Meta Data.Exist]]></Disp>
</NodeArgs>
</Step>
<NodeArgs eType="Context" icon="6" nRep="63" >
<Disp><![CDATA[eSkyDesk Management]]></Disp>
</NodeArgs>
</Step>
<NodeArgs eType="Context" icon="5" nRep="62" >
<Disp><![CDATA[eSkyDesk Management]]></Disp>
</NodeArgs>
</Step>
<Step rID="T38">
<Obj ><![CDATA[Get 'Button' with name 'Add Meta Data' at Browser 'eSkyDesk Management' successfully ]]></Obj>
<Details ><![CDATA[Passed]]></Details>
<Time><![CDATA[9/6/2014 - 9:22:04]]></Time>
<TimeTick>1409970124</TimeTick>
<NodeArgs eType="User" icon="10" nRep="65" status="Passed" >
<Disp><![CDATA[Get 'Button' with name 'Add Meta Data' at Browser 'eSkyDesk Management' successfully ]]></Disp>
</NodeArgs>
</Step>
<Step rID="T39">
<Obj plainTxt="False" ><![CDATA[eSkyDesk Management]]></Obj>
<Details plainTxt="False" ><![CDATA[Browser]]></Details>
<Time><![CDATA[9/6/2014 - 9:22:04]]></Time>
<TimeTick>1409970124</TimeTick>
<Step rID="T40">
<Obj plainTxt="False" ><![CDATA[eSkyDesk Management]]></Obj>
<Details plainTxt="False" ><![CDATA[Page]]></Details>
<Time><![CDATA[9/6/2014 - 9:22:04]]></Time>
<TimeTick>1409970124</TimeTick>
<Step rID="T41">
<Obj plainTxt="False" ><![CDATA[Add Meta Data.Exist]]></Obj>
<Details plainTxt="False" ><![CDATA["Object exists"]]></Details>
<Time><![CDATA[9/6/2014 - 9:22:04]]></Time>
<TimeTick>1409970124</TimeTick>
<NodeArgs eType="Replay" icon="7" nRep="69" >
<Disp><![CDATA[Add Meta Data.Exist]]></Disp>
</NodeArgs>
</Step>
<Step rID="T42">
<Obj plainTxt="False" ><![CDATA[Add Meta Data.Click]]></Obj>
<Details plainTxt="False" ><![CDATA[]]></Details>
<Time><![CDATA[9/6/2014 - 9:22:04]]></Time>
<TimeTick>1409970124</TimeTick>
<NodeArgs eType="Replay" icon="7" nRep="71" >
<Disp><![CDATA[Add Meta Data.Click]]></Disp>
</NodeArgs>
</Step>
<NodeArgs eType="Context" icon="6" nRep="68" >
<Disp><![CDATA[eSkyDesk Management]]></Disp>
</NodeArgs>
</Step>
<NodeArgs eType="Context" icon="5" nRep="67" >
<Disp><![CDATA[eSkyDesk Management]]></Disp>
</NodeArgs>
</Step>
<Step rID="T43">
<Obj ><![CDATA[Press button 'Add Meta Data' at Browser 'eSkyDesk Management' successfully]]></Obj>
<Details ><![CDATA[Passed]]></Details>
<Time><![CDATA[9/6/2014 - 9:22:05]]></Time>
<TimeTick>1409970125</TimeTick>
<NodeArgs eType="User" icon="10" nRep="72" status="Passed" >
<Disp><![CDATA[Press button 'Add Meta Data' at Browser 'eSkyDesk Management' successfully]]></Disp>
</NodeArgs>
</Step>
<Step rID="T44">
<Obj plainTxt="False" ><![CDATA[eSkyDesk Management]]></Obj>
<Details plainTxt="False" ><![CDATA[Browser]]></Details>
<Time><![CDATA[9/6/2014 - 9:22:05]]></Time>
<TimeTick>1409970125</TimeTick>
<Step rID="T45">
<Obj plainTxt="False" ><![CDATA[eSkyDesk Management]]></Obj>
<Details plainTxt="False" ><![CDATA[Page]]></Details>
<Time><![CDATA[9/6/2014 - 9:22:05]]></Time>
<TimeTick>1409970125</TimeTick>
<Step rID="T46">
<Obj plainTxt="False" ><![CDATA[WebEdit_2.Exist]]></Obj>
<Details plainTxt="False" ><![CDATA["Object exists"]]></Details>
<Time><![CDATA[9/6/2014 - 9:22:05]]></Time>
<TimeTick>1409970125</TimeTick>
<NodeArgs eType="Replay" icon="11" nRep="76" >
<Disp><![CDATA[WebEdit_2.Exist]]></Disp>
</NodeArgs>
</Step>
<NodeArgs eType="Context" icon="6" nRep="75" >
<Disp><![CDATA[eSkyDesk Management]]></Disp>
</NodeArgs>
</Step>
<NodeArgs eType="Context" icon="5" nRep="74" >
<Disp><![CDATA[eSkyDesk Management]]></Disp>
</NodeArgs>
</Step>
<Step rID="T47">
<Obj ><![CDATA[Get 'Button' with name 'OK' at Browser 'eSkyDesk Management' successfully ]]></Obj>
<Details ><![CDATA[Passed]]></Details>
<Time><![CDATA[9/6/2014 - 9:22:08]]></Time>
<TimeTick>1409970128</TimeTick>
<NodeArgs eType="User" icon="10" nRep="77" status="Passed" >
<Disp><![CDATA[Get 'Button' with name 'OK' at Browser 'eSkyDesk Management' successfully ]]></Disp>
</NodeArgs>
</Step>
<Step rID="T48">
<Obj plainTxt="False" ><![CDATA[eSkyDesk Management]]></Obj>
<Details plainTxt="False" ><![CDATA[Browser]]></Details>
<Time><![CDATA[9/6/2014 - 9:22:08]]></Time>
<TimeTick>1409970128</TimeTick>
<Step rID="T49">
<Obj plainTxt="False" ><![CDATA[eSkyDesk Management]]></Obj>
<Details plainTxt="False" ><![CDATA[Page]]></Details>
<Time><![CDATA[9/6/2014 - 9:22:08]]></Time>
<TimeTick>1409970128</TimeTick>
<Step rID="T50">
<Obj plainTxt="False" ><![CDATA[OK.Exist]]></Obj>
<Details plainTxt="False" ><![CDATA["Object exists"]]></Details>
<Time><![CDATA[9/6/2014 - 9:22:08]]></Time>
<TimeTick>1409970128</TimeTick>
<NodeArgs eType="Replay" icon="7" nRep="81" >
<Disp><![CDATA[OK.Exist]]></Disp>
</NodeArgs>
</Step>
<Step rID="T51">
<Obj plainTxt="False" ><![CDATA[OK.Click]]></Obj>
<Details plainTxt="False" ><![CDATA[]]></Details>
<Time><![CDATA[9/6/2014 - 9:22:08]]></Time>
<TimeTick>1409970128</TimeTick>
<NodeArgs eType="Replay" icon="7" nRep="83" >
<Disp><![CDATA[OK.Click]]></Disp>
</NodeArgs>
</Step>
<NodeArgs eType="Context" icon="6" nRep="80" >
<Disp><![CDATA[eSkyDesk Management]]></Disp>
</NodeArgs>
</Step>
<NodeArgs eType="Context" icon="5" nRep="79" >
<Disp><![CDATA[eSkyDesk Management]]></Disp>
</NodeArgs>
</Step>
<Step rID="T52">
<Obj ><![CDATA[Press button 'OK' at Browser 'eSkyDesk Management' successfully]]></Obj>
<Details ><![CDATA[Passed]]></Details>
<Time><![CDATA[9/6/2014 - 9:22:08]]></Time>
<TimeTick>1409970128</TimeTick>
<NodeArgs eType="User" icon="10" nRep="84" status="Passed" >
<Disp><![CDATA[Press button 'OK' at Browser 'eSkyDesk Management' successfully]]></Disp>
</NodeArgs>
</Step>
<Step rID="T53">
<Obj plainTxt="False" ><![CDATA[eSkyDesk Management]]></Obj>
<Details plainTxt="False" ><![CDATA[Browser]]></Details>
<Time><![CDATA[9/6/2014 - 9:22:08]]></Time>
<TimeTick>1409970128</TimeTick>
<Step rID="T54">
<Obj plainTxt="False" ><![CDATA[eSkyDesk Management]]></Obj>
<Details plainTxt="False" ><![CDATA[Page]]></Details>
<Time><![CDATA[9/6/2014 - 9:22:08]]></Time>
<TimeTick>1409970128</TimeTick>
<Step rID="T55">
<Obj plainTxt="False" ><![CDATA[OK_2.Exist]]></Obj>
<Details plainTxt="False" ><![CDATA["Object exists"]]></Details>
<Time><![CDATA[9/6/2014 - 9:22:08]]></Time>
<TimeTick>1409970128</TimeTick>
<NodeArgs eType="Replay" icon="7" nRep="88" >
<Disp><![CDATA[OK_2.Exist]]></Disp>
</NodeArgs>
</Step>
<NodeArgs eType="Context" icon="6" nRep="87" >
<Disp><![CDATA[eSkyDesk Management]]></Disp>
</NodeArgs>
</Step>
<NodeArgs eType="Context" icon="5" nRep="86" >
<Disp><![CDATA[eSkyDesk Management]]></Disp>
</NodeArgs>
</Step>
<Step rID="T56">
<Obj ><![CDATA[Get 'Button' with name 'OK_2' at Browser 'eSkyDesk Management' successfully ]]></Obj>
<Details ><![CDATA[Passed]]></Details>
<Time><![CDATA[9/6/2014 - 9:22:11]]></Time>
<TimeTick>1409970131</TimeTick>
<NodeArgs eType="User" icon="10" nRep="89" status="Passed" >
<Disp><![CDATA[Get 'Button' with name 'OK_2' at Browser 'eSkyDesk Management' successfully ]]></Disp>
</NodeArgs>
</Step>
<Step rID="T57">
<Obj plainTxt="False" ><![CDATA[eSkyDesk Management]]></Obj>
<Details plainTxt="False" ><![CDATA[Browser]]></Details>
<Time><![CDATA[9/6/2014 - 9:22:11]]></Time>
<TimeTick>1409970131</TimeTick>
<Step rID="T58">
<Obj plainTxt="False" ><![CDATA[eSkyDesk Management]]></Obj>
<Details plainTxt="False" ><![CDATA[Page]]></Details>
<Time><![CDATA[9/6/2014 - 9:22:11]]></Time>
<TimeTick>1409970131</TimeTick>
<Step rID="T59">
<Obj plainTxt="False" ><![CDATA[OK_2.Exist]]></Obj>
<Details plainTxt="False" ><![CDATA["Object exists"]]></Details>
<Time><![CDATA[9/6/2014 - 9:22:11]]></Time>
<TimeTick>1409970131</TimeTick>
<NodeArgs eType="Replay" icon="7" nRep="93" >
<Disp><![CDATA[OK_2.Exist]]></Disp>
</NodeArgs>
</Step>
<Step rID="T60">
<Obj plainTxt="False" ><![CDATA[OK_2.Click]]></Obj>
<Details plainTxt="False" ><![CDATA[]]></Details>
<Time><![CDATA[9/6/2014 - 9:22:11]]></Time>
<TimeTick>1409970131</TimeTick>
<NodeArgs eType="Replay" icon="7" nRep="95" >
<Disp><![CDATA[OK_2.Click]]></Disp>
</NodeArgs>
</Step>
<NodeArgs eType="Context" icon="6" nRep="92" >
<Disp><![CDATA[eSkyDesk Management]]></Disp>
</NodeArgs>
</Step>
<NodeArgs eType="Context" icon="5" nRep="91" >
<Disp><![CDATA[eSkyDesk Management]]></Disp>
</NodeArgs>
</Step>
<Step rID="T61">
<Obj ><![CDATA[Press button 'OK_2' at Browser 'eSkyDesk Management' successfully]]></Obj>
<Details ><![CDATA[Passed]]></Details>
<Time><![CDATA[9/6/2014 - 9:22:11]]></Time>
<TimeTick>1409970131</TimeTick>
<NodeArgs eType="User" icon="10" nRep="96" status="Passed" >
<Disp><![CDATA[Press button 'OK_2' at Browser 'eSkyDesk Management' successfully]]></Disp>
</NodeArgs>
</Step>
<Step rID="T62">
<Obj plainTxt="False" ><![CDATA[eSkyDesk Management]]></Obj>
<Details plainTxt="False" ><![CDATA[Browser]]></Details>
<Time><![CDATA[9/6/2014 - 9:22:12]]></Time>
<TimeTick>1409970132</TimeTick>
<Step rID="T63">
<Obj plainTxt="False" ><![CDATA[eSkyDesk Management]]></Obj>
<Details plainTxt="False" ><![CDATA[Page]]></Details>
<Time><![CDATA[9/6/2014 - 9:22:12]]></Time>
<TimeTick>1409970132</TimeTick>
<Step rID="T64">
<Obj plainTxt="False" ><![CDATA[WebEdit_2.Set]]></Obj>
<Details plainTxt="False" ><![CDATA["Add_MD"]]></Details>
<Time><![CDATA[9/6/2014 - 9:22:12]]></Time>
<TimeTick>1409970132</TimeTick>
<NodeArgs eType="Replay" icon="11" nRep="101" >
<Disp><![CDATA[WebEdit_2.Set]]></Disp>
</NodeArgs>
</Step>
<Step rID="T65">
<Obj plainTxt="False" ><![CDATA[select.Select]]></Obj>
<Details plainTxt="False" ><![CDATA["String"]]></Details>
<Time><![CDATA[9/6/2014 - 9:22:12]]></Time>
<TimeTick>1409970132</TimeTick>
<NodeArgs eType="Replay" icon="13" nRep="104" >
<Disp><![CDATA[select.Select]]></Disp>
</NodeArgs>
</Step>
<NodeArgs eType="Context" icon="6" nRep="100" >
<Disp><![CDATA[eSkyDesk Management]]></Disp>
</NodeArgs>
</Step>
<NodeArgs eType="Context" icon="5" nRep="99" >
<Disp><![CDATA[eSkyDesk Management]]></Disp>
</NodeArgs>
</Step>
<Step rID="T66">
<Obj ><![CDATA[Get 'Button' with name 'OK' at Browser 'eSkyDesk Management' successfully ]]></Obj>
<Details ><![CDATA[Passed]]></Details>
<Time><![CDATA[9/6/2014 - 9:22:15]]></Time>
<TimeTick>1409970135</TimeTick>
<NodeArgs eType="User" icon="10" nRep="105" status="Passed" >
<Disp><![CDATA[Get 'Button' with name 'OK' at Browser 'eSkyDesk Management' successfully ]]></Disp>
</NodeArgs>
</Step>
<Step rID="T67">
<Obj plainTxt="False" ><![CDATA[eSkyDesk Management]]></Obj>
<Details plainTxt="False" ><![CDATA[Browser]]></Details>
<Time><![CDATA[9/6/2014 - 9:22:15]]></Time>
<TimeTick>1409970135</TimeTick>
<Step rID="T68">
<Obj plainTxt="False" ><![CDATA[eSkyDesk Management]]></Obj>
<Details plainTxt="False" ><![CDATA[Page]]></Details>
<Time><![CDATA[9/6/2014 - 9:22:15]]></Time>
<TimeTick>1409970135</TimeTick>
<Step rID="T69">
<Obj plainTxt="False" ><![CDATA[OK.Exist]]></Obj>
<Details plainTxt="False" ><![CDATA["Object exists"]]></Details>
<Time><![CDATA[9/6/2014 - 9:22:15]]></Time>
<TimeTick>1409970135</TimeTick>
<NodeArgs eType="Replay" icon="7" nRep="109" >
<Disp><![CDATA[OK.Exist]]></Disp>
</NodeArgs>
</Step>
<Step rID="T70">
<Obj plainTxt="False" ><![CDATA[OK.Click]]></Obj>
<Details plainTxt="False" ><![CDATA[]]></Details>
<Time><![CDATA[9/6/2014 - 9:22:15]]></Time>
<TimeTick>1409970135</TimeTick>
<NodeArgs eType="Replay" icon="7" nRep="111" >
<Disp><![CDATA[OK.Click]]></Disp>
</NodeArgs>
</Step>
<NodeArgs eType="Context" icon="6" nRep="108" >
<Disp><![CDATA[eSkyDesk Management]]></Disp>
</NodeArgs>
</Step>
<NodeArgs eType="Context" icon="5" nRep="107" >
<Disp><![CDATA[eSkyDesk Management]]></Disp>
</NodeArgs>
</Step>
<Step rID="T71">
<Obj ><![CDATA[Press button 'OK' at Browser 'eSkyDesk Management' successfully]]></Obj>
<Details ><![CDATA[Passed]]></Details>
<Time><![CDATA[9/6/2014 - 9:22:15]]></Time>
<TimeTick>1409970135</TimeTick>
<NodeArgs eType="User" icon="10" nRep="112" status="Passed" >
<Disp><![CDATA[Press button 'OK' at Browser 'eSkyDesk Management' successfully]]></Disp>
</NodeArgs>
</Step>
<Step rID="T72">
<Obj plainTxt="False" ><![CDATA[[ Window ].Exist]]></Obj>
<Details plainTxt="False" ><![CDATA["Object does not exist"]]></Details>